{
  "schema_version": "0.3.0",
  "policy_id": "ADF-PHASE3-SOC-001",
  "version": "0.3.0",
  "evidence": {
    "hypothesis_claim": "COMPROMISE",
    "maximum_age_seconds": 3600,
    "minimum_reliability": 0.7,
    "minimum_relevance": 0.5,
    "minimum_overall_strength_for_allow": 0.75,
    "minimum_corroborating_sources": 2,
    "maximum_conflicts_for_allow": 0,
    "trust_weights": {
      "HIGH": 1.0,
      "MEDIUM": 0.75,
      "LOW": 0.4,
      "UNTRUSTED": 0.0
    },
    "required_source_types_by_action": {
      "NETWORK_ISOLATE": [
        "asset_inventory",
        "endpoint",
        "identity",
        "network",
        "threat_intel"
      ]
    },
    "trusted_sources": {
      "CMDB_PRIMARY": {
        "source_type": "asset_inventory",
        "reliability": 0.98,
        "trust_level": "HIGH"
      },
      "EDR_PRIMARY": {
        "source_type": "endpoint",
        "reliability": 0.96,
        "trust_level": "HIGH"
      },
      "IDP_PRIMARY": {
        "source_type": "identity",
        "reliability": 0.96,
        "trust_level": "HIGH"
      },
      "NETWORK_PRIMARY": {
        "source_type": "network",
        "reliability": 0.94,
        "trust_level": "HIGH"
      },
      "CTI_PRIMARY": {
        "source_type": "threat_intel",
        "reliability": 0.82,
        "trust_level": "MEDIUM"
      }
    }
  },
  "consequence": {
    "factor_weights": {
      "criticality": 0.24,
      "blast_radius": 0.18,
      "downtime": 0.13,
      "mission_impact": 0.16,
      "safety_impact": 0.09,
      "availability_impact": 0.12,
      "dependency": 0.08,
      "isolation_consequence": 0.18
    },
    "criticality_weights": {
      "LOW": 0.10,
      "MEDIUM": 0.35,
      "HIGH": 0.70,
      "TIER_0": 1.0
    },
    "blast_radius_weights": {
      "LOCAL": 0.05,
      "SERVICE": 0.50,
      "ENTERPRISE": 1.0
    },
    "impact_weights": {
      "NONE": 0.0,
      "LOW": 0.10,
      "MEDIUM": 0.45,
      "HIGH": 0.75,
      "CRITICAL": 1.0
    },
    "downtime_reference_minutes": 120,
    "dependency_reference_count": 4,
    "irreversible_penalty": 0.20,
    "high_threshold": 0.50,
    "critical_threshold": 0.75,
    "approval_levels": ["HIGH", "CRITICAL"],
    "approval_isolation_consequences": ["HIGH", "CRITICAL"],
    "approval_mission_impacts": ["CRITICAL"],
    "approval_safety_impacts": ["HIGH"],
    "approval_availability_impacts": ["CRITICAL"],
    "approval_blast_radii": ["ENTERPRISE"],
    "approval_downtime_minutes": 60,
    "cascading_requires_approval": true
  },
  "decision_rules": [
    {"id": "P3-DENY-IDENTITY", "condition": "IDENTITY_FATAL", "outcome": "DENY"},
    {"id": "P3-DENY-EVIDENCE-INTEGRITY", "condition": "EVIDENCE_FATAL", "outcome": "DENY"},
    {"id": "P3-DENY-ACTION-TARGET", "condition": "TARGET_TYPE_PROHIBITED", "outcome": "DENY"},
    {"id": "P3-ESCALATE-PROTECTED-ASSET", "condition": "TARGET_TIER_0", "outcome": "ESCALATE"},
    {"id": "P3-ESCALATE-CONSEQUENCE", "condition": "CONSEQUENCE_REQUIRES_APPROVAL", "outcome": "ESCALATE"},
    {"id": "P3-DENY-AUTHORITY", "condition": "AUTHORITY_INSUFFICIENT", "outcome": "DENY"},
    {"id": "P3-ESCALATE-EVIDENCE", "condition": "EVIDENCE_NOT_AUTOMATION_GRADE", "outcome": "ESCALATE"},
    {"id": "P3-ALLOW-CONSTRAINED", "condition": "PARAMETER_CONSTRAINTS_PRESENT", "outcome": "ALLOW_CONSTRAINED"},
    {"id": "P3-ALLOW-REVERSIBLE", "condition": "DEFAULT", "outcome": "ALLOW"}
  ],
  "action_catalog": {
    "NETWORK_ISOLATE": {
      "reversible": true,
      "allowed_target_types": [
        "DOMAIN_CONTROLLER",
        "WORKSTATION"
      ],
      "required_authority": "endpoint_containment",
      "tier_0_required_authority": "tier_0_containment",
      "maximum_duration_seconds": 3600,
      "preserve_management_required": true,
      "human_approval_criticalities": [
        "HIGH",
        "TIER_0"
      ]
    }
  },
  "target_inventory": {
    "DOMAIN_CONTROLLER_01": {
      "type": "DOMAIN_CONTROLLER",
      "criticality": "TIER_0",
      "classification": "RESTRICTED",
      "dependencies": [
        "AUTHENTICATION_SERVICE",
        "DIRECTORY_SERVICES",
        "KERBEROS"
      ],
      "isolation_consequence": "CRITICAL",
      "estimated_downtime_minutes": 120,
      "blast_radius": "ENTERPRISE",
      "mission_impact": "CRITICAL",
      "safety_impact": "MEDIUM",
      "availability_impact": "CRITICAL",
      "human_approval_required": true
    },
    "WORKSTATION_042": {
      "type": "WORKSTATION",
      "criticality": "LOW",
      "classification": "INTERNAL",
      "dependencies": [],
      "isolation_consequence": "LOW",
      "estimated_downtime_minutes": 15,
      "blast_radius": "LOCAL",
      "mission_impact": "LOW",
      "safety_impact": "NONE",
      "availability_impact": "LOW",
      "human_approval_required": false
    }
  },
  "authorization": {
    "ttl_seconds": 120,
    "single_use": true
  },
  "approval": {
    "ttl_seconds": 900
  }
}
